{
  "$schema": "https://json-schema.org/draft/2020-12/schema",
  "$id": "https://siio.local/contracts/agents/AGT-003/v2-draft/opportunity-preflight.response.schema.json",
  "title": "AGT-003 opportunity preflight preview response",
  "type": "object",
  "additionalProperties": false,
  "required": ["contract_version", "capability_id", "correlation_id", "snapshot_id", "policy_version", "model", "generated_at", "actions"],
  "properties": {
    "contract_version": { "const": "agt003-preflight-v1" },
    "capability_id": { "const": "agt003.opportunity-preflight.preview" },
    "correlation_id": { "type": "string", "minLength": 1 },
    "snapshot_id": { "type": "string", "minLength": 1 },
    "policy_version": { "type": "string", "minLength": 1 },
    "model": { "type": "string", "minLength": 1 },
    "generated_at": { "type": "string", "format": "date-time" },
    "actions": {
      "type": "array",
      "maxItems": 8,
      "items": {
        "type": "object",
        "additionalProperties": false,
        "required": ["issue_code", "title", "description", "evidence_refs"],
        "properties": {
          "issue_code": {
            "enum": ["next_action", "close_date", "decision_maker", "stalled_conversation", "pending_terms", "escalation_needed", "other"]
          },
          "title": { "type": "string", "minLength": 1, "maxLength": 200 },
          "description": { "type": "string", "minLength": 1, "maxLength": 1000 },
          "evidence_refs": {
            "type": "array",
            "minItems": 1,
            "maxItems": 5,
            "uniqueItems": true,
            "items": { "type": "string", "minLength": 1 }
          }
        }
      }
    }
  }
}
